{
  "product_id": "vertex-machine-cognition-cm-96",
  "synthetic": true,
  "vertical": "workstation",
  "vertical_schema_version": "1.0",
  "status": "active",
  "effective_from": "2026-09-01",
  "identity": {"make": "Vertex Machine", "model": "Cognition", "model_number": "CM-96"},
  "description": "Synthetic competing large-memory workstation with a higher sample price and thinner validation record.",
  "commercial": {
    "sample_price_usd": 19500,
    "sample_lead_time_weeks": 7,
    "warranty_years": 3,
    "support_level": "onsite"
  },
  "specifications": {
    "form_factor": "desktop",
    "cpu": {"make": "Example Silicon", "family": "Matrix Pro", "model": "MP48", "cores": 48, "threads": 96},
    "gpu": {"make": "Example Graphics", "model": "Compute Pro 9600", "vram_gb": 96, "memory_type": "GDDR7 ECC"},
    "memory": {"capacity_gb": 384, "type": "DDR5", "speed_mt_s": 5200, "ecc": true},
    "storage": {"total_capacity_tb": 8, "primary": {"capacity_tb": 4, "type": "NVMe SSD", "interface": "PCIe 5.0"}, "secondary": {"capacity_tb": 4, "type": "NVMe SSD", "interface": "PCIe 4.0"}},
    "power": {"max_draw_w": 1600, "required_voltage": [240]},
    "operating_systems": ["Windows 11 Pro", "Linux"],
    "certifications": ["ExampleAI Runtime"],
    "display": null
  },
  "evidence": [
    {"source_id": "synthetic-competitor-catalog-v1", "source_type": "synthetic_public_catalog", "observed_at": "2026-09-01", "confidence": 0.78, "note": "Fictional market observation; not a purchasable product."}
  ]
}
